date,role,type,content,image,status
21/10/2025,post,both,"@người theo dõi Tin vui cho toàn bộ ae saler BDS khu vực {để tên khu vực vào}, đặc biệt là thành viên của Revoland. Sắp tới sẽ có rất nhiều chiến dịch thu hút lượng lớn khách hàng trải nghiệm xem nhà, thuê nhà trên nền tảng. 
Nắm bắt cơ hội đăng ký ngay hôm nay để nhận ưu đãi đăng bài miễn phí trong 1 tháng (trị giá 3$). 
Trải nghiệm ngay tại: https://www.revoland.vn/
Fanpage: https://www.facebook.com/Revolandofficial
Cộng đồng Revoland: https://www.facebook.com/groups/proptechrevoland",https://scontent.fsgn5-12.fna.fbcdn.net/v/t39.30808-6/567716156_4032101147037569_2712785541359182177_n.jpg?_nc_cat=103&ccb=1-7&_nc_sid=127cfc&_nc_ohc=bXk-3jPIRXkQ7kNvwHXtegp&_nc_oc=AdlA4oUXU134SueVbq0uDuhyDyAOIp0_68RGDZn_2zpjtihIErea091vTg0UaKgNPrg&_nc_zt=23&_nc_ht=scontent.fsgn5-12.fna&_nc_gid=8uirkbAJhmfylSrtYMSc8w&oh=00_AffJL1AtA9znvYxQnKoggcivA6On5o8N6Z8jqI7747Z_zA&oe=68FCB533,0
22/10/2025,post,page,"Không thể tin được khách hàng đầu tiên lại đến từ Revoland. Tôi yêu revoland, revoland mang tiền đến cho tôi.",Không cần ảnh,0
22/10/2025,post,both,"Người đàn ông có hơn 100 căn nhà cho thuê, thu 79 tỷ đồng mỗi năm, thừa nhận “nghiện” mua bất động sản.",Không cần ảnh,0
