Fanpage,Link
Hội mua bán nhà đất Long An,https://www.facebook.com/groups/1834366309991657/
BĐS Long An,https://www.facebook.com/groups/longhauland/
Nhà Đất Long An,https://www.facebook.com/groups/2077092969032853/
Mua bán nhà đất Long An,https://www.facebook.com/groups/2307580429580305/
BẤT ĐỘNG SẢN TỈNH LONG AN,https://www.facebook.com/groups/1201725910636111/
BDS LONG AN,https://www.facebook.com/groups/729788667712498/
Nhà Đất Long An,https://www.facebook.com/groups/1524940264891823/
MUA BÁN NHÀ ĐẤT LONG AN,https://www.facebook.com/groups/2117061568309942/
Bất Động Sản Bến Lức,https://www.facebook.com/groups/446283535805651/
Nhóm Bất động sản Long An,https://www.facebook.com/groups/191755044707455/
Bất động sản long an,https://www.facebook.com/groups/827004347667446/
NHÀ ĐẤT TPHCM LONG AN ✅,https://www.facebook.com/groups/1554266442080514/
