Thể loại,Tiêu đề,Link bài báo,content
Startup & Tech Media,Rent a Cyber Friend will pay you to talk to strangers online and will show off its platform at TechCrunch Disrupt 2025.,https://techcrunch.com/2025/10/16/rent-a-cyber-friend-will-pay-you-to-talk-to-strangers-online-and-will-show-off-its-platform-at-techcrunch-disrupt-2025/,"Francesco Vitali will be the first to admit that when his co-founder Chris Siametis first pitched him onRent a Cyber Friend, he didn’t quite get the idea.
“Who’s going to pay somebody to speak with somebody?” Vitali told TechCrunch. “But Chris was insistent. Chris is a millennial, and I’m Gen X, so it wasn’t easy for me to understand his vision.”
Vitali had worked with Siametis for about two decades; they ran48FILM, aninternational short film festival(Vitali is also a film producer). So he took a leap of faith to trust his collaborator on the idea he couldn’t shake: a video chat platform where people can pay per minute for a casual conversation with a “cyber friend.”
Rent a Cyber Friend ballooned to 3 million registered users without raising venture capital or spending any money on marketing. The company doesn’t even have social media because it’s too short-staffed to devote resources to it. The startup is part ofStartup Battlefieldand will be presenting atTechCrunch Disrupt 2025at the end of this month in San Francisco.
The company’s fast growth proved Vitali’s first reactions wrong, but as he used the product himself, he began to realize that there’s a big market for human connection — especially in a time when people are paying to talk to AI bots.
“Loneliness is the biggest disease in the world right now,” Vitali said. “Millions are lonely, and they are underemployed or seeking purpose. So, we built a platform where human time has value again, and a place where being human is important.”
Cyber friends are first vetted to verify their identity, and then they can set a per-minute rate to charge for their conversations; the platform keeps 20% of that fee. People aren’t just paying for companionship. Some cyber friends charge a higher rate if they’re an academic or vetted expert in a specific subject area, or if they speak a particular language that a user would like to practice.
For any social media platform — especially one that connects people in real-time video chats — safety and content moderation is a challenge. Vitali notes that the platform has a block feature, but as the company continues to grow, it will need to invest further in maintaining a healthy environment. He said that next on the product road map is a more robust and efficient system for vetting potential cyber friends more quickly and thoroughly.
Vitali’s turning point came not long after the company launched when he connected with a 19-year-old from China. He noticed that this person was one of the site’s most active users, and he spent $200 per day to talk to people. Vitali rigged the site so that he would be the only cyber friend available and used the opportunity to ask the user about his experience without revealing that he founded the company.
“He said, ‘I don’t feel safe to go out at the mall and meet with strangers, but this site gives me the possibility to exchange culture and meet people from all over the world,’ and that was the first moment that I realized we have something here,” Vitali recalled.
He still thinks that the connections that people make in person are irreplaceable. But on an internet where people are sucked intoaddictiveordangerousconnections with AI chatbots that are designed to maximize engagement, this step of turning toward humanity means something to him.
If you want to learn more about Rent a Cyber Friend from the company itself — while also checking out dozens of others, hearing their pitches, and listening to guest speakers on four different stages — join us at Disrupt, October 27 to 29, in San Francisco.Learn more here."
Startup & Tech Media,A new wave of social media apps provide hope in a doomscrolling world.,https://techcrunch.com/2025/10/16/a-new-wave-of-social-media-apps-provide-hope-in-a-doomscrolling-world/,"Zehra Naqvi recalls the magical days of the early social internet.
She grew up in the One  Direction and Marvel fandoms in the early 2010s. This was back when people posted photos of lattes using the Valencia filter on Instagram, and Twitter was still Twitter, a place where people came together to exchange jokes and cultural analysis.
But now Instagram is full of influencers, and Twitter is X, a digital town hall with a  fierce political divide.
“The platforms that won were the ones that kept people scrolling the longest, not the ones that made them feel the most connected,”  Naqvi told TechCrunch. “Now there is an abundance of content but a scarcity of joy.”
But that is starting to change. Naqvi is part of the new wave of social media: interest-first, niche online communities. This month, sheannounced the launch of her company,Lore— a site that helps fans keep up with their fandoms.
Users increasingly want to spend less time on generalized sites like Facebook,  Instagram, and Twitter, and instead join online communities tailored to their interests, she believes.
Natalie Dillon, a consumer investor at venture firm Maveron, says she’s starting to see an increasing number of founders build interest-first networks.
“At its core, consumer behavior is pushing a shift from performance to participation,” Dillon told TechCrunch. “For the next generation, community isn’t a feature layered on top of a product. It is the product.”
She offers examples likeBeli, an app that lets users share their favorite restaurants with friends, orFizz, which connects people going to the same college. Others include the  astrology-bonding  appCo-Star, or evenPartiful, which lets people connect with friends to plan events.
These are the types of participatory apps that Naqvi wants to build — something resembling the early social internet before it  “became fractured and joyless.”
“Niche spaces give people permission to be specific and to show up as their whole selves without being lost in the algorithm,” she said.
The previous generation of social media companies found success through “more,” she continued; more followers, more reach, more noise.  But some founders and users are now coming to a different conclusion  —  maybe there  isn’t  one social media app that will  become “the next big thing. ”There will be several.
Maybe that’s the point.
“What we have learned is that depth matters more than breadth,” Naqvi said.
Of course, private groups like subreddits, Discord servers, and Facebook communities have always existed. On X, following many of the same accounts was also a way to enter a different online sphere: Think Tech Twitter or Black Twitter.
But large sites’ algorithms curate content for users by giving a person more of what they think they want to see. Content creators are not innocent either, feeding and fueling trends, topics, and discussions — anything that could spark fame and keep steady eyeballs on their work.
“We hit a saturation point,” Naqvi said. “Everyone is tired of doomscrolling and performative content.”
In other words, the days of building large, generalized sites like Facebook are over, according to Claire Wardle, an associate professor at Cornell University, who studies contemporary information ecosystems.
Wardle said users have grown worried about how much time they are spending online, content moderation, hyper-political spaces, and the permanence of social media posts.
Naturally, there are a few glaring exceptions: Beijing-based TikTok, which has seen massive growth in popularity in recent years, wasbriefly outlawed in the U.S.as the government worried over the scale of its potential influence.  Even Facebook’s Threadsnow has over 400 million active monthly usersas of this month.
But all of these have founding roots in what has already become the “last generation” of social media. Wardle, in particular, called TikTok a “broadcast-style” site.
“For the rare few who love the spotlight, that works,” Maya Watson, founder of the recentlyshuttered social media website Why?!said. She is now working on another app in stealth. “Most people didn’t sign up to be creators; we just wanted community.”
Alphonzo Terrell’s social network Spill has found much success by focusing on community.
Spill became a refuge for Black X users who fled in the wake of rising extremism. Terrell said Spill shifted its design from simply feeding users content to matching them with communities that might be of interest to them.
For example, those who like watching the WNBA can join a group specifically for that. Spill also has games, like Spades — a staple in the Black community — and has partnered with Netflix, Amazon, and Paramount to host co-viewing events called “Tea Parties,” in which users can watch movies and sports together on the app.
“The next era of social media isn’t about the biggest follower counts,” Terrell told TechCrunch. “It’s about depth; helping people find their people.”
Many Black users also fled toBlacksky, founded by Rudy Fraser. With Blacksky, he’s building an open-sourced network on the same protocol and distribution network asBluesky.
Bluesky’s user base is currentlynearing 40 million, according to an online user tracker built with the Bluesky API. Wardle called the social network a representative of how online communities are seeking out content more tailored to their political interests, given Bluesky’s left-wing bent.
But Blacksky takes it one step further.
It targets minorities and marginalized individuals and has an algorithm that can filter out racial harassment.  Unlike X, where a user might block one racist person and then see another,  users on  Blacksky can completely filter out whatever they want from their timelines, providing a custom social media experience.
“Sometimes you need a global stage. Sometimes  you just want a cozy corner with close internet friends where you can control who sees what,” Fraser told TechCrunch.
Users own their data and can decide to host such information on  Blacksky rather than Bluesky, giving them  control over who has access to their content.
People also vote on decisions together, Fraser said, such as what the community guidelines should be and if non-Black users should be allowed to post in the community.
“Until now, folks have had to make the choice, unconsciously or otherwise, between the jankiness of the fediverse or closed platforms where they have no control,” Fraser said. (Thefediverse is another network of open social web servicesbuilt on a different protocol, ActivityPub.)
“We’re demonstrating with AT Protocol that you can have a great user experience, have a good time again on the internet, and have real autonomy the entire time,” Fraser said.
Artificial intelligence is playing a big part in helping build more niche social communities.
Austin Clements, a managing partner at the firm Slauson & Co., is seeing founders use AI to build apps that understand nuance so well, they go beyond niche social networks into tailored experiences.
“The newer apps are natively built for the niche itself, enabling them to create the tools and features most relevant to that niche,” he told TechCrunch. “In fact, newer applications typically lead with the tools and call the social part ‘community.’”
Naqvi’s product has an AI tool, though she remains mum on further details. Her product is a search engine that lets people go down internet rabbit holes. It provides an interactive experience, linking to fan theories, cultural context, and easter eggs; it builds personalized graphs, reveals fandom updates, and gives users monthly reports on their obsessions.
“One of our early testers said it best: ‘It’s like Wikipedia — but if Wikipedia knew exactly what I was thinking,’” she said, adding that her users call her “Mother Lore.”
Emily Herrera, a consumer investor who worked at Slow Ventures, said that creators, like Naqvi, are now in the front seat of this new social media ecosystem. Creators are moving away from participating in the “broadcast” ecosystem to instead building environments in which they operate as owners, she said, citing newsletters as an example of this trend.
Dani Tran, a principal at BITKRAFT Ventures, said she’s also seeing the further rise of “niche passion communities” in gaming, givingSuperbloom, a gaming studio that targets underrepresented audiences, as an example.
“Looking ahead, the most vibrant social communities will be those built around interactive experiences,” she said.
Maveron’s Dillon added to that. “The winners will be the platforms that combine intimacy, utility, and creativity in one ecosystem,” she said. “They won’t look like traditional social networks; they’ll feel like multiplayer environments where people can build, buy, and belong all at once.”
Or, as Naqvi put it: People “want tools that help them remember why being online was fun in the first place.”"
Startup & Tech Media,Deel hits $17.3B valuation after raising $300M from big-name VCs.,https://techcrunch.com/2025/10/16/deel-hits-17-3b-valuation-after-raising-300m-from-big-name-vcs/,"As entertaining as it’s been forthe tech industry to watchrival payroll decacorns Deel and Ripplingsue each otherovera corporate spying scandal, top-tier VCs are apparently not terribly scared off. Deel on Thursdayannouncedthat it has raised a $300 million Series E round co-led by A-list fintech VC firm Ribbit Capital and Andreessen Horowitz, with participation from existing investors like Coatue Management and General Catalyst.
Deel says it’s been profitable for three years and surpassed $1 billion in ARR, including having a month — September — that hit $100 million in revenue. Deel’s business model focuses on serving global companies, handling the complexities of currency and employment regulation for far-flung international teams. It says it’s now grown to 35,000+ customers with more than 1.5 million workers in over 150 countries.
Those are the types of numbers that attract investment, pending lawsuits or no. (Rippling’s California-filed lawsuit against Deel does not yet have a trial date and is in the discovery phase, according tocourt records.) Indeed, Ribbit’s founder, Micky Malka, and a16z co-founder Ben Horowitz, gave Deel their full-throated supported in the announcement. In prepared statements, Malka said that Ribbit has been a “fan” of the HR company for a long time, because it’s a “a brand companies trust,” and Horowitz said that a16z has been “blown away” by Deel’s work to build “the best HR platform” for global companies.
For what it’s worth, the lawsuits have not slowed down Rippling’s fundraising efforts either. In May,Rippling raised a $450 million Series Ground at a $16.8 billion valuation.
"
Startup & Tech Media,How a headphone site operator built loyalty startup Lantern to solve his own problems.,https://techcrunch.com/2025/10/16/how-a-headphone-site-operator-built-loyalty-startup-lantern-to-solve-his-own-problems/,"Andrew Lissimore has been running the audio apparel siteHeadphones.comfor nearly a decade now. While audiophiles have a high affinity toward their gear and want to try out new gadgets, Lissimore wasn’t satisfied with continuously spending money on platforms like Meta and Google to acquire new customers; he wanted to find a way to better retain the customers he already had.
The founder started to look for solutions within the Shopify ecosystem that would help the business with loyalty programs. But most of what he found offered only spend and tier-based solutions. So he decided to build his own system.
What started as a project to solve loyalty for Headphones.com is now a startup calledLantern, which other companies can use to easily integrate loyalty solutions into their own businesses.
Initially, the company wired together different apps to have a variety of loyalty points based on stamps, spend, points, and referrals, but it was hard to manage. Plus, bringing together different apps introduced challenges with user experience flows and brand identity.
“We thought it would be great to have a Shopify native system for loyalty that is easy to customize and integrate,” Lissimore said. “I managed to convince Shopify designers Kyle Peatt and Dominic McPhee, who built their Polaris design system, to work on this.”
Later, both joined Lantern as co-founders. Peatt currently works as the chief design and product officer, and McPhee works as the chief technology officer. In total, the company currently has eight full-time employees.
Lantern can handle customer account creation and management, loyalty, and referrals for any vendor working on Shopify. Websites can reward returning or new customers and award them points for activities like participating in forums, as well. The company explained that the sellers can easily integrate their solution and don’t need to add any extra code to do so.
Lissimore said that operating Headphones.com provided the perfect testing ground for Lantern to understand the pain points of being a seller and getting better retention.
“I think we were in the perfect spot to come up with something like Lantern because we [headphones.com] were so desperate to increase the repurchase rate. A lot of businesses like clothing brands or makeup brands have naturally built in repurchase, but for us, it was existential,” he told TechCrunch.
After Headphones.com adopted Lantern, its purchase rate for repeat visitors increased from 30% to 50%. The period for buying a second pair of headphones has also reduced from 198 days to 98 days.
The company now has clients like skincare site Counter, which rakes in over $200 million a year, and footwear brand Vessi. It has also built tools to measure retention effectively to show Lantern’s value to its clients.
To further grow its business, Lantern raised $3.1 million in seed funding led by Salesforce Ventures, with participation from Sidekick Partners, Day One Ventures, and individual investors like Vessi’s Tony Yu. The company directly competes with existing startups such asLoyaltyLionandYotpo.
Rob Keith, a partner at Salesforce Ventures, said that Lantern stood out to the firm because the startup is approaching retention through means that go beyond point-based loyalty with a flexible approach.
“Lantern brings together something unique — Andrew built and scaled Headphones.com and lived these retention challenges as a merchant, while Kyle and Dominic come from Shopify, where they built the Polaris design system that thousands of developers use today. That combination means they understand both what merchants actually need and how to build solutions that feel native to the platform rather than bolted on,” he said.
Keith added that Lantern’s features, like wallet functionality, directly appearing in checkout without any pop-ups or redirects, help both consumers and brands.
In its product roadmap, the company plans to leverage AI and provide customers with insights and recommendations around retention."
Startup & Tech Media,Final 2 days to claim your exhibit table at TechCrunch Disrupt 2025.,https://techcrunch.com/2025/10/16/final-2-days-to-claim-your-exhibit-table-at-techcrunch-disrupt-2025/,"TechCrunch Disrupt 2025takes place October 27-29 in San Francisco’s Moscone West, and exhibit space is nearly full. With less than two days left to secure your table,nowis the time to step in before a competitor takes your place.
Showcase your brand to 10,000 founders, investors, media, and tech leaders on the hunt for the next breakthrough. Build a year’s worth of connections in just three days. Generate hot leads. Capture investor attention.
If your work is making waves, your vision excites, or your team is ready to grow,this is your momentto shine at one of the most anticipated tech conferences of the year.
Every conversation. Every connection. Every moment counts at Disrupt. Lock in your table by tomorrow, October 17, before a competitor takes your spotlight.Book now."
Startup & Tech Media,General Intuition lands $134M seed to teach agents spatial reasoning using video game clips.,https://techcrunch.com/2025/10/16/general-intuition-lands-134m-seed-to-teach-agents-spatial-reasoning-using-video-game-clips/,"Medal, a platform for uploading and sharing video game clips, has spun out a new frontier AI research lab that’s using its trove of gaming videos to train and build foundation models and AI agents that can understand how objects and entities move through space and time — a concept known as spatial-temporal reasoning.
Called General Intuition, the startup is betting that Medal’s dataset — which consists of 2 billion videos per year from 10 million monthly active users across tens of thousands of games — surpasses alternatives like Twitch or YouTube for training agents.
“When you play video games, you essentially transfer your perception, usually through a first-person view of the camera, to different environments,” Pim de Witte, CEO of Medal and General Intuition, told TechCrunch.  He noted that gamers who upload clips tend to post very negative or positive examples, which serve as really useful edge cases for training. “You get this selection bias towards precisely the kind of data you actually want to use for training work.”
This data moat is what reportedly attracted the attention of OpenAI, which late last year attempted to acquire Medal for $500 million, perThe Information. (Neither OpenAI nor General Intuition would comment on the report.)
It’s also what has led to General Intuition’s raising a whopping $133.7 million in seed funding, led by Khosla Ventures and General Catalyst with participation from Raine.
The startup intends to use the funds to grow its team of researchers and engineers focused on training a general agent that can interact with the world around it, aiming for initial applications in gaming, and search-and-rescue drones.
De Witte says the founding team has already made strides: General Intuition’s model can understand environments it wasn’t trained on and correctly predict actions within them. It’s able to do this purely through visual input; agents only see what a human player would see, and they move through space by following controller inputs. This approach, the company says, can transfer naturally to physical systems like robotic arms, drones, and autonomous vehicles, which are often manipulated by humans using video game controllers.
General Intuition’s next milestone is twofold: generating new simulated worlds for training other agents and autonomously navigating entirely unfamiliar physical environments.
That technical approach is shaping how the company plans to commercialize its technology and sets it apart from competitors building world models.
While General Intuition is also building world models on which to train its agents, such models aren’t the product. Unlike other world model makers like DeepMind and World Labs, which are selling their world modelsGenieandMarble, respectively, for training agents and content creation, General Intuition is focusing on other use cases to avoid copyright issues.
“Our goal is not to produce models that compete with game developers,” de Witte said.
Instead, the startup’s gaming applications center around creating bots and non-player characters that can surpass traditional “deterministic bots,” or preprogrammed characters that produce the same output every time.
“[The bots] can scale to any level of difficulty,” Moritz Baier-Lentz, a founding member of General Intuition and partner at Lightspeed Ventures, told TechCrunch. “It’s not compelling to create a god bot that beats everyone, but if you can scale gradually and fill in liquidity for any player situation so that their win rate is always around 50%, that will maximize their engagement and retention.”
De Witte also has a background in humanitarian work, which informs the startup’s focus on powering search-and-rescue drones, which sometimes have to navigate unfamiliar environments and extract information without GPS.
Ultimately, de Witte and Baier-Lentz see General Intuition’s core functionality — spatial-temporal reasoning — as a crucial piece in the race toward artificial general intelligence (AGI). While major AI labs focus on building ever more powerful large language models, General Intuition believes true AGI requires something LLMs fundamentally lack.
“As humans, we create text to describe what’s going on in our world, but in doing so, you lose a lot of information,” de Witte said. “You lose general intuition around spatial-temporal reasoning.”"
